<?xml version="1.0" encoding="UTF-8"?>
<redSocial xmlns:xsi="http://www.w3.org/2001/XMLSchema-instance"
    xsi:noNamespaceSchemaLocation="ejerciccio8.xsd">
    <usuarios>
        <usuario id="12">
            <nombreUsuario>pepita10_10</nombreUsuario>
            <email>pepita@hotmail.com</email>
            <seguidores>123</seguidores>
            <publicacion>
                <titulo>lo mejor</titulo>
                <fecha>2025-12-30</fecha>
                <like>123</like>
                <comentario>
                    <autor>esteban</autor>
                    <contenido>humor</contenido>
                    <fecha>2025-11-28</fecha>
                </comentario>
            </publicacion>
        </usuario>
    </usuarios>
</redSocial>
